{
  "$schema": "https://flower.dev/schemas/security/v1.json",
  "schemaVersion": 1,
  "secretScan": {
    "maxFileBytes": 1048576,
    "exclude": [
      ".git/**",
      "node_modules/**",
      ".next/**",
      "coverage/**",
      ".flower/cache/**",
      ".flower/journal/local/**"
    ]
  },
  "dependencies": {
    "requireLockfile": true,
    "forbidUnpinnedTags": true,
    "forbidRemoteSources": true
  },
  "headers": {
    "enabled": true,
    "file": "next.config.ts",
    "required": [
      { "name": "Content-Security-Policy" },
      { "name": "X-Content-Type-Options", "value": "nosniff" },
      { "name": "Referrer-Policy", "value": "strict-origin-when-cross-origin" },
      { "name": "Permissions-Policy" },
      { "name": "X-Frame-Options", "value": "DENY" },
      { "name": "Strict-Transport-Security" }
    ],
    "forbiddenContentSecurityPolicyTokens": ["'unsafe-eval'"]
  }
}
